{
  "id": "PN-23A",
  "title": "Importer duty: verify relevant conformity assessment carried out (Art. 43)",
  "type": "duty",
  "article_refs": [ { "article": 23, "paragraph": 1, "point": "(a)" } ],
  "legal_consequence": { "verbatim": "Before placing a high-risk AI system on the market, importers shall ensure that the system is in conformity with this Regulation by verifying that the relevant conformity assessment procedure referred to in Article 43 has been carried out by the provider of the high-risk AI system.", "context": { "items": [ { "label": "Penalty (Art. 99)", "kind": "guidance", "text": "Obligation/requirement; fines up to EUR 15,000,000 or 3% turnover may apply.", "sources": [ { "article": 99, "paragraph": 2 } ] } ], "refs": ["cons:penalty_art99_requirements"] } },
  "side_info": { "effective_from": "2026-08-02" },
  "requirements": { "root": "R-1", "nodes": [ { "id": "R-1", "label": "All gates", "kind": "composite", "operator": "allOf", "children": ["R-1.1","R-1.2","R-1.3","R-1.4"] }, { "id": "R-1.1", "label": "Art. 2 scope", "kind": "primitive", "ref": "qp:in_scope_art2" }, { "id": "R-1.2", "label": "Actor is importer", "kind": "primitive", "ref": "qp:is_importer" }, { "id": "R-1.3", "label": "High-risk", "kind": "primitive", "ref": "qp:is_high_risk" }, { "id": "R-1.4", "label": "Not Art. 2(2)", "kind": "composite", "operator": "not", "children": ["R-1.4.1"] }, { "id": "R-1.4.1", "label": "Art. 2(2) applies", "kind": "primitive", "ref": "ex:art2_2_product_safety_pathway" } ] },
  "shared_refs": ["qp:in_scope_art2","qp:is_importer","qp:is_high_risk","ex:art2_2_product_safety_pathway"],
  "metadata": { "version": "1.0", "status": "draft", "extraction_date": "2025-10-21" },
  "test_vectors": []
}

