{
  "id": "PN-25B",
  "title": "Initial provider duty: cooperate with new provider and make available necessary information/access (with exception where specified)",
  "type": "duty",
  "article_refs": [ { "article": 25, "paragraph": 2 } ],
  "legal_consequence": { "verbatim": "Where the circumstances referred to in paragraph 1 occur, the provider that initially placed the AI system on the market or put it into service shall no longer be considered to be a provider of that specific AI system for the purposes of this Regulation. That initial provider shall closely cooperate with new providers and shall make available the necessary information and provide the reasonably expected technical access and other assistance that are required for the fulfilment of the obligations set out in this Regulation, in particular regarding the compliance with the conformity assessment of high-risk AI systems. This paragraph shall not apply in cases where the initial provider has clearly specified that its AI system is not to be changed into a high-risk AI system and therefore does not fall under the obligation to hand over the documentation.", "context": { "items": [ { "label": "Exception", "kind": "guidance", "text": "No obligation to hand over documentation where initial provider clearly specified system is not to be changed into a high-risk AI system.", "sources": [ { "article": 25, "paragraph": 2 } ] } ], "refs": ["cons:penalty_art99_requirements"] } },
  "side_info": { "effective_from": "2026-08-02" },
  "requirements": { "root": "R-1", "nodes": [ { "id": "R-1", "label": "All gates", "kind": "composite", "operator": "allOf", "children": ["R-1.1","R-1.2","R-1.3","R-1.4"] }, { "id": "R-1.1", "label": "Art. 2 scope", "kind": "primitive", "ref": "qp:in_scope_art2" }, { "id": "R-1.2", "label": "Actor is initial provider", "kind": "primitive", "question": { "prompt": "Is the actor the initial provider who placed or put the AI system into service?", "answer_type": "boolean" }, "sources": [ { "article": 25, "paragraph": 2 } ] }, { "id": "R-1.3", "label": "Art. 25(1) circumstances occurred", "kind": "primitive", "ref": "ex:art25_becomes_provider" }, { "id": "R-1.4", "label": "Exception does not apply (not specified against HR change)", "kind": "composite", "operator": "not", "children": ["R-1.4.1"] }, { "id": "R-1.4.1", "label": "Initial provider clearly specified system not to be changed into high-risk", "kind": "primitive", "question": { "prompt": "Did the initial provider clearly specify its AI system is not to be changed into a high-risk AI system?", "answer_type": "boolean" }, "sources": [ { "article": 25, "paragraph": 2 } ] } ] },
  "shared_refs": ["qp:in_scope_art2","ex:art25_becomes_provider"],
  "metadata": { "version": "1.0", "status": "draft", "extraction_date": "2025-10-21" },
  "test_vectors": []
}

