{
  "id": "PN-22A",
  "title": "Provider duty: appoint an authorised representative in the Union (third-country providers)",
  "type": "duty",
  "article_refs": [ { "article": 22, "paragraph": 1, "quote": "Prior to making their high-risk AI systems available on the Union market, providers established in third countries shall, by written mandate, appoint an authorised representative which is established in the Union." } ],
  "legal_consequence": {
    "verbatim": "Prior to making their high-risk AI systems available on the Union market, providers established in third countries shall, by written mandate, appoint an authorised representative which is established in the Union.",
    "context": { "items": [ { "label": "Penalty (Art. 99)", "kind": "guidance", "text": "Obligation/requirement; administrative fines up to EUR 15,000,000 or 3% turnover may apply.", "sources": [ { "article": 99, "paragraph": 2 } ] } ], "refs": ["cons:penalty_art99_requirements"] }
  },
  "side_info": { "effective_from": "2026-08-02" },
  "requirements": {
    "root": "R-1",
    "nodes": [
      { "id": "R-1", "label": "All gates must hold", "kind": "composite", "operator": "allOf", "children": ["R-1.1","R-1.2","R-1.3","R-1.4","R-1.5"] },
      { "id": "R-1.1", "label": "Global scope (Art. 2)", "kind": "primitive", "ref": "qp:in_scope_art2" },
      { "id": "R-1.2", "label": "Actor is provider (Art. 3(2))", "kind": "primitive", "ref": "qp:is_provider" },
      { "id": "R-1.3", "label": "System is high-risk (Art. 6)", "kind": "primitive", "ref": "qp:is_high_risk" },
      { "id": "R-1.4", "label": "Provider established in third country", "kind": "primitive", "question": { "prompt": "Is the provider established in a third country (outside the Union)?", "answer_type": "boolean" }, "sources": [ { "article": 22, "paragraph": 1 } ] },
      { "id": "R-1.5", "label": "Not product-safety carve-out (Art. 2(2))", "kind": "composite", "operator": "not", "children": ["R-1.5.1"] },
      { "id": "R-1.5.1", "label": "Product-safety pathway applies", "kind": "primitive", "ref": "ex:art2_2_product_safety_pathway" }
    ]
  },
  "shared_refs": ["qp:in_scope_art2","qp:is_provider","qp:is_high_risk","ex:art2_2_product_safety_pathway"],
  "metadata": { "version": "1.0", "status": "draft", "extraction_date": "2025-10-21" },
  "test_vectors": []
}

