{
  "id": "PN-24B",
  "title": "Distributor duty: withhold making available if non-conform; inform provider/importer if risk",
  "type": "duty",
  "article_refs": [ { "article": 24, "paragraph": 2 } ],
  "legal_consequence": { "verbatim": "Where a distributor considers or has reason to consider, on the basis of the information in its possession, that a high-risk AI system is not in conformity with the requirements set out in Section 2, it shall not make the high-risk AI system available on the market until the system has been brought into conformity with those requirements. Furthermore, where the high-risk AI system presents a risk within the meaning of Article 79(1), the distributor shall inform the provider or the importer of the system, as applicable, to that effect.", "context": { "items": [ { "label": "Penalty (Art. 99)", "kind": "guidance", "text": "Obligation/requirement; fines up to EUR 15,000,000 or 3% turnover may apply.", "sources": [ { "article": 99, "paragraph": 2 } ] } ], "refs": ["cons:penalty_art99_requirements"] } },
  "side_info": { "effective_from": "2026-08-02" },
  "requirements": { "root": "R-1", "nodes": [ { "id": "R-1", "label": "All gates", "kind": "composite", "operator": "allOf", "children": ["R-1.1","R-1.2","R-1.3","R-1.4"] }, { "id": "R-1.1", "label": "Art. 2 scope", "kind": "primitive", "ref": "qp:in_scope_art2" }, { "id": "R-1.2", "label": "Actor is distributor", "kind": "primitive", "ref": "qp:is_distributor" }, { "id": "R-1.3", "label": "High-risk", "kind": "primitive", "ref": "qp:is_high_risk" }, { "id": "R-1.4", "label": "Not Art. 2(2)", "kind": "composite", "operator": "not", "children": ["R-1.4.1"] }, { "id": "R-1.4.1", "label": "Art. 2(2) applies", "kind": "primitive", "ref": "ex:art2_2_product_safety_pathway" } ] },
  "shared_refs": ["qp:in_scope_art2","qp:is_distributor","qp:is_high_risk","ex:art2_2_product_safety_pathway"],
  "metadata": { "version": "1.0", "status": "draft", "extraction_date": "2025-10-21" },
  "test_vectors": []
}

